congress,chamber,rollnumber,date,session,clerk_rollnumber,yea_count,nay_count,nominate_mid_1,nominate_mid_2,nominate_spread_1,nominate_spread_2,nominate_log_likelihood,bill_number,vote_result,vote_desc,vote_question,dtl_desc
96,Senate,1,1979-02-22,,,51,38,-0.042,-0.157,0.605,-1.059,-0.47,SRES61,,,,"TO TABLE THE STEVENS AMENDMENT TO S. RES. 61, A RESOLUTION TO AMEND THE STANDING RULES OF THE SENATE.  THE STEVENS AMENDMENT PROVIDES THAT THE 100 HOUR TIME CAP ON DEBATE AFTER CLOTURE CONSISTS OF ONE HOUR PER SENATOR. (MOTION PASSED)"
96,Senate,2,1979-02-22,,,52,39,-0.082,-0.997,0.432,-0.171,-10.557,SRES61,,,,TO TABLE THE HELMS AMENDMENT TO S. RES. 61.  THE HELMS AMENDMENT LIMITS DEBATE AFTER CLOTURE TO NOT MORE THAN 8 HOURS A DAY. (MOTION PASSED)
96,Senate,3,1979-02-22,,,92,2,0.0,0.0,0.0,0.0,0.0,SRES61,,,,"TO AMEND S. RES. 61, BY PROHIBITING THE REDUCTION OF THE POST-CLOTURE CAP BELOW 100 HOURS.  (MOTION PASSED)"
96,Senate,4,1979-02-22,,,51,43,-0.191,-0.326,0.251,-0.285,-17.967,SRES61,,,,"TO TABLE THE STEVENS AMENDMENT TO S. RES. 61.  THE STEVENS AMENDMENT DELETES LANGUAGE AND SUBSTITUTES A PROVISION PERMITTING A SENATOR TO YIELD HIS POST-CLOTURE DEBATE TIME TO ANOTHER, BUT PROHIBITS ANY SENATOR FROM ACCUMULATING MORE THAN 3 HOURS.  (MOTION PASSED)"
96,Senate,5,1979-02-22,,,55,37,-0.255,-0.747,0.625,-0.841,-4.934,SRES61,,,,TO TABLE THE JAVITS AMENDMENT TO S. RES. 61.  THE JAVITS AMENDMENT EXEMPTS TIME REQUIRED FOR ROLLCALLS FROM THE 100-HOUR CAP ON DEBATE AFTER CLOTURE.  (MOTION PASSED)
96,Senate,6,1979-02-22,,,78,16,0.374,-0.497,0.658,0.73,-10.913,SRES61,,,,TO AGREE TO S. RES. 61.  (MOTION PASSED)
96,Senate,7,1979-02-22,,,34,53,-0.244,-0.117,0.217,0.076,-32.906,SRES54,,,,"TO DISCHARGE THE COMMITTEE ON ENERGY AND NATURAL RESOURCES FROM FURTHER CONSIDERATION OF S. RES. 54, A RESOLUTION DISAPPROVING THE PRESIDENT'S ENERGY ACTION, REGARDING EXEMPTING AVIATION GASOLINE AND KEROSENE-BASE JET FUEL FROM MANDATORY PETROLEUM ALLOCATION REGULATIONS. (MOTION FAILED)"
96,Senate,8,1979-02-26,,,56,29,0.169,0.985,0.374,-0.163,-12.066,,,,,TO GO INTO EXECUTIVE SESSION TO CONSIDER THE NOMINATION OF LEONARD WOODCOCK TO BE U.S. AMBASSADOR TO THE PEOPLE'S REPUBLIC OF CHINA.  (MOTION PASSED)
96,Senate,9,1979-02-26,,,82,9,0.508,0.862,0.251,-0.02,-17.509,,,,,TO ADVISE AND CONSENT TO THE NOMINATION OF LEONARD WOODCOCK TO BE U.S. AMBASSADOR TO THE PEOPLE'S REPUBLIC OF CHINA. (MOTION PASSED)
96,Senate,10,1979-03-07,,,33,62,0.17,-0.949,-0.184,-0.057,-35.566,S245,,,,"TO AMEND S. 245, A BILL TO PROMOTE U.S. FOREIGN POLICY THROUGH THE MAINTENANCE OF RELATIONS WITH THE PEOPLE OF TAIWAN, BY SUBSTITUTING THE WORD ""TAIWAN"" FOR ""THE PEOPLE OF TAIWAN.""  (MOTION FAILED)"
96,Senate,11,1979-03-07,,,57,38,-0.022,0.236,0.18,0.142,-35.174,S245,,,,"TO TABLE THE HUMPHREY AMENDMENT TO S. 245.  THE HUMPHREY AMENDMENT ESTABLISHES AN OFFICIAL LIAISON OFFICE FOR THE CONDUCTING OF RELATIONS BETWEEM THE U.S. AND TAIWAN, RATHER THAN THE UNOFFICIAL AMERICAN INSTITUTE PROVIDED FOR IN THE BILL.  (MOTION PASSED)"
96,Senate,12,1979-03-08,,,45,49,-0.091,-0.996,0.29,0.064,-25.51,S245,,,,TO TABLE THE PERCY AMENDMENT TO S. 245.  THE PERCY AMENDMENT STATES THAT THE SECURITY INTERESTS OF THE U.S. WOULD BE THREATENED IF TAIWAN WERE TO BE ATTACKED. (MOTION FAILED)
96,Senate,13,1979-03-08,,,42,50,0.042,-0.999,-0.283,-0.14,-26.042,S245,,,,TO AMEND S. 245 BY STATING THAT THE SECURITY INTERESTS OF THE U.S. WOULD BE THREATENED IF TAIWAN WERE TO BE ATTACKED. (MOTION FAILED)
96,Senate,14,1979-03-12,,,49,36,0.049,-0.62,-0.192,-0.344,-35.087,S245,,,,"TO TABLE THE MODIFIED SUBSTITUTE CHURCH AMENDMENT TO THE BOREN AMENDMENT TO S. 245.  THE BOREN AMENDMENT ALLOWS TAIWAN TO KEEP ITS U.S. EMBASSY BUILDING. THE CHURCH SUBSTITUTE PROVIDES FOR A COURT DECISION ON THE ""REAL PROPERTY"" QUESTION.  (MOTION PASSED)"
96,Senate,15,1979-03-13,,,54,38,0.043,-0.473,0.213,0.093,-28.282,S245,,,,"TO TABLE THE DOLE AMENDMENT TO S.245, PROVIDING FOR THE APPOINTMENT BY THE PRESIDENT, WITH SENATE CONSENT, OF A DIRECTOR TO HEAD THE AMERICAN INSTITUTE IN TAIWAN. (MOTION PASSED)"
96,Senate,16,1979-03-13,,,74,21,0.323,-0.788,0.212,0.079,-27.534,S245,,,,TO TABLE THE MODIFIED HUMPHREY AMENDMENT TO S.245.  THE HUMPHREY AMENDMENT MAKES THE EFFECTIVE DATE OF THE TREATY CONTINGENT UPON THE PRESIDENT'S SECURING WRITTEN ASSURANCES FROM THE PEOPLE'S REPUBLIC OF CHINA THAT IT WILL NOT ATTACK TAIWAN.  (MOTION PASSED)
96,Senate,17,1979-03-13,,,90,6,0.554,-0.832,0.256,-0.007,-13.251,S245,,,,"TO PASS S. 245, THE TAIWAN ENABLING ACT.  (MOTION PASSED)"
96,Senate,18,1979-03-14,,,42,55,-0.023,-0.384,0.042,0.16,-61.617,HR2439,,,,"TO AGREE TO A SUBSTITUTE AMENDMENT TO H.R. 2439, A BILL TO RESCIND CERTAIN BUDGET AUTHORITY.  THE KENNEDY AMENDMENT, IN THE NATURE OF A SUBSTITUTE TO THE JOHNSON AMENDMENT (SEE RC 19), RESTORES FUNDING FOR MEDICAL SCHOOLS.  (MOTION FAILED)"
96,Senate,19,1979-03-14,,,14,83,0.056,0.998,-0.049,-0.272,-39.64,HR2439,,,,"TO AMEND H.R. 2439, A BILL TO RESCIND CERTAIN BUDGET AUTHORITY, BY RESTORING THE FULL AMOUNT OF THE PROPOSED RESCISSION. (MOTION FAILED)"
96,Senate,20,1979-03-26,,,46,44,-0.14,-0.99,0.305,-0.022,-22.008,HR2534,,,,"TO TABLE THE DOLE AMENDMENT TO THE DOLE AMENDMENT TO H.R. 2534, A BILL PROVIDING FOR A TEMPORARY INCREASE IN THE PUBLIC DEBT LIMIT.  THE DOLE AMENDMENT, AS INTRODUCED, REQUIRED A TWO-THIRDS VOTE OF BOTH THE HOUSE AND THE SENATE TO APPROVE A BUDGET DEFICIT.  THE DOLE AMENDMENT TO THE DOLE AMENDMENT PROHIBITS A DEBT LIMIT INCREASE WITHOUT A BALANCED OR SURPLUS BUDGET OR MORE THAN TWO-THIRDS OF BOTH THE HOUSE AND THE SENATE AGREEING TO A RESOLUTION PROJECTING A DEFICIT.  (MOTION PASSED)"
96,Senate,21,1979-03-26,,,36,54,-0.03,-0.47,-0.193,0.048,-24.975,HR2534,,,,TO TABLE THE LONG SUBSTITUTE AMENDMENT TO THE DOLE AMENDMENT TO H.R. 2534. THE LONG AMENDMENT REQUIRES THE BUDGET COMMITTEES TO SUBMIT BALANCED BUDGETS WITH A REPORT ON THE CONSEQUENCES.  (SEE RC 20) (MOTION FAILED)
96,Senate,22,1979-03-27,,,57,42,-0.008,-0.425,0.173,0.023,-34.923,HR2534,,,,"TO AMEND THE DOLE AMENDMENT TO H.R. 2534 BY REQUIRING THE BUDGET COMMITTEE, IN ITS APRIL 1980 RESOLUTION, TO REPORT A BALANCED FEDERAL BUDGET FOR FISCAL 1981.  (SEE RC 20) (MOTION PASSED)"
96,Senate,23,1979-03-27,,,85,12,0.29,0.957,0.088,0.213,-34.006,HR2534,,,,TO TABLE THE DECONCINI AMENDMENT TO H.R. 2534.  THE DECONCINI AMENDMENT REQUIRES THE FEDERAL GOVERNMENT TO END DEFICIT FINANCING.  (MOTION PASSED)
96,Senate,24,1979-03-27,,,96,2,0.0,0.0,0.0,0.0,0.0,HR2534,,,,"TO AMEND H.R. 2534 BY PROVIDING THAT AFTER FY 1980 THE STATUTORY DEBT LIMIT CANNOT BE INCREASED ABOVE THE LEVEL IN EFFECT MAY 1, 1980, UNLESS CERTAIN CONDITIONS ARE MET. (MOTION PASSED)"
96,Senate,25,1979-03-27,,,93,2,0.0,0.0,0.0,0.0,0.0,HR2534,,,,TO AMEND H.R. 2534 BY REQUIRING THE PRESIDENT TO SUBMIT BOTH A BALANCED AND ALTERNATE BUDGET.  (MOTION PASSED)
96,Senate,26,1979-03-27,,,69,28,-0.258,-0.244,-0.109,-0.352,-41.363,HR2534,,,,"TO TABLE THE MODIFIED MOYNIHAN AMENDMENT TO H.R. 2534.  THE MOYNIHAN AMENDMENT REQUIRES THAT DURING CONSIDERATION OF BALANCING THE BUDGET, CONSIDERATION BE GIVEN TO THE IMPACT OF EQUAL PER CAPITA EXPENDITURE LEVELS.  (MOTION PASSED)"
96,Senate,27,1979-03-27,,,61,33,0.081,-0.668,0.24,0.015,-21.932,HR2534,,,,"TO TABLE THE ARMSTRONG AMENDMENT TO H.R. 2534.  THE ARMSTRONG AMENDMENT PROVIDES FOR INDIVIDUAL TAX REDUCTIONS DURING THE YEARS 1981-1984, CONTINGENT UPON CERTAIN LIMITATIONS ON FEDERAL SPENDING.  (MOTION PASSED)"
96,Senate,28,1979-03-27,,,62,33,0.107,-0.093,0.161,0.238,-38.277,HR2534,,,,TO PASS H.R. 2534.  (MOTION PASSED)
96,Senate,29,1979-03-28,,,44,54,0.087,0.996,0.042,-0.08,-64.355,SRES115,,,,"TO AGREE TO S. RES. 115, MAKING RULE 44 OF THE STANDING RULES OF THE SENATE EFFECTIVE ON JANUARY 2, 1979.  THIS RULE LIMITS THE OUTSIDE EARNED INCOME OF SENATORS. (MOTION FAILED)"
96,Senate,30,1979-03-28,,,82,15,0.455,0.891,0.077,0.143,-43.115,HR1147,,,,"TO PASS H.R. 1147, A BILL TO TEMPORARILY EXTEND THE AUTHORITY OF THE SECRETARY OF THE TREASURY TO WAIVE THE IMPOSITION OF COUNTERVAILING DUTIES.  (MOTION PASSED)"
96,Senate,31,1979-03-28,,,66,27,-0.019,-1.0,-0.107,-0.225,-48.006,,,,,"TO AGREE TO S. CON. RES. 8, A RESOLUTION PROVIDING FOR IMPARTIAL OBSERVERS AT THE FORTHCOMING ELECTION IN RHODESIA. (MOTION PASSED)"
96,Senate,32,1979-03-29,,,85,4,-0.97,-0.244,-0.222,0.335,-15.59,HR2479,,,,"TO ADOPT THE CONFERENCE REPORT ON H.R. 2479, THE U.S.-TAIWAN RELATIONS ACT.  (MOTION PASSED)"
96,Senate,33,1979-04-02,,,36,41,-0.075,0.293,-0.317,-0.094,-16.336,HR2283,,,,"TO AMEND H.R. 2283, A BILL TO INCREASE FUNDS FOR AND EXTEND THE LIFE OF THE COUNCIL ON WAGE AND PRICE STABILITY, BY REQUIRING THAT ONE HALF OF THE EXPENDITURES OF THE COUNCIL BE SPENT TO MONITOR FEDERAL INFLATION POLICIES. (MOTION FAILED)"
96,Senate,34,1979-04-02,,,28,56,-0.188,-0.832,0.325,0.167,-25.174,HR2283,,,,"TO AMEND H.R. 2283, DEALING WITH THE COUNCIL ON WAGE AND PRICE STABILITY, BY EXTENDING THE LIFE OF THE RENEGOTIATION BOARD THROUGH JUNE 30, 1979.  (MOTION FAILED)"
96,Senate,35,1979-04-02,,,62,22,0.179,0.39,0.224,0.085,-20.561,HR2283,,,,"TO PASS H.R. 2283, A BILL TO INCREASE FUNDS FOR AND EXTEND THE LIFE OF THE COUNCIL ON WAGE AND PRICE STABILITY. (MOTION PASSED)"
96,Senate,36,1979-04-05,,,43,43,-0.175,0.136,0.297,0.961,-20.649,S210,,,,"TO TABLE THE HELMS AMENDMENT TO S.210, A BILL TO ESTABLISH A FEDERAL DEPARTMENT OF EDUCATION.  THE HELMS AMENDMENT WOULD RESTORE THE RIGHT OF VOLUNTARY PRAYER IN PUBLIC SCHOOLS. (MOTION FAILED)"
96,Senate,37,1979-04-05,,,47,37,-0.172,-0.006,-0.263,-0.818,-21.984,S210,,,,TO AMEND S.210 BY RESTORING THE RIGHT OF VOLUNTARY PRAYER IN PUBLIC SCHOOLS.  (MOTION PASSED) (CONTINUED) SEE NOTE(S) 4
96,Senate,38,1979-04-05,,,55,27,0.085,-0.716,0.212,-0.005,-22.98,,,,,TO RECESS.  (MOTION PASSED)
96,Senate,39,1979-04-09,,,51,40,-0.128,-0.072,-0.364,-1.174,-19.433,S450,,,,"TO AMEND S. 450, THE SUPREME COURT JURISDICTION ACT OF 1979, BY RESTORING THE RIGHT OF VOLUNTARY PRAYER IN PUBLIC SCHOOLS.  (MOTION PASSED)"
96,Senate,40,1979-04-09,,,61,30,-0.507,0.364,-0.133,-0.368,-42.992,S450,,,,"TO PASS S. 450, THE SUPREME COURT JURISDICTION ACT OF 1979. (MOTION PASSED)"
96,Senate,41,1979-04-09,,,41,53,0.049,-0.194,-0.236,-0.456,-30.135,S210,,,,TO TABLE THE RIBICOFF MOTION TO RECONSIDER THE VOTE BY WHICH THE HELMS AMENDMENT TO S.210 WAS AGREED TO.  (SEE RC 37) (MOTION FAILED) (CONTINUED) SEE NOTE(S) 4
96,Senate,42,1979-04-09,,,50,43,0.251,-0.689,0.335,0.806,-27.117,S210,,,,TO RECONSIDER THE VOTE BY WHICH THE HELMS AMENDMENT TO S. 210 WAS AGREED TO.  (SEE RC 37).  (MOTION PASSED) SEE NOTE(S) 4
96,Senate,43,1979-04-09,,,38,57,0.31,-0.901,-0.336,-0.616,-28.458,S210,,,,TO TABLE THE RIBICOFF AMENDMENT TO THE HELMS AMENDMENT TO S. 210. THE RIBICOFF AMENDMENT REQUIRES THE UNDERSECRETARY TO CONSULT WITH THE SECRETARY CONCERNING THE RECOMMENDATIONS OF THE INTERGOVERNMENTAL ADVISORY COUNCIL ON EDUCATION.  (SEE RC 37) (MOTION FAILED) SEE NOTE(S) 4
96,Senate,44,1979-04-09,,,53,40,0.064,-0.17,0.231,0.563,-29.587,S210,,,,TO TABLE THE HELMS AMENDMENT AS AMENDED BY THE RIBICOFF AMENDMENT TO S. 210.  (SEE RC 43)  (MOTION PASSED) SEE NOTE(S) 4
96,Senate,45,1979-04-24,,,23,67,-0.191,0.919,-0.088,-0.321,-40.897,,,,,"TO AMEND S. CON. RES. 22, AN ALTERNATIVE CONGRESSIONAL BUDGET FOR THE U.S. FOR FISCAL YEARS 1980-1982, BY PROVIDING A BALANCED BUDGET FOR FY 1980.   (MOTION FAILED)"
96,Senate,46,1979-04-24,,,24,69,-0.34,-0.017,0.2,0.378,-31.401,,,,,TO AMEND S. CON. RES. 22 BY REDUCING NEW BUDGET AUTHORITY AND OUTLAYS FOR NATIONAL DEFENSE BY .8 PERCENT AND TRANSFERRING PART OF THESE FUNDS TO THE ELDERLY NUTRITIONAL PROGRAM AND THE EDUCATION PROGRAMS FOR THE HANDICAPPED. (MOTION FAILED) SEE NOTE(S) 5
96,Senate,47,1979-04-24,,,29,63,0.187,-0.246,-0.234,-0.338,-26.26,,,,,TO AMEND S. CON. RES. 22 BY REDUCING THE BUDGET AUTHORITY BY $1 BILLION AND REDUCING CETA JOB PROGRAM FUNDING BY $400 MILLION.  (MOTION FAILED) SEE NOTE(S) 5
96,Senate,48,1979-04-24,,,38,50,0.165,-0.129,-0.115,-0.443,-39.189,,,,,"TO AMEND S. CON. RES. 22 BY REDUCING BUDGET AUTHORITY BY $1 BILLION, THUS CUTTING FOREIGN AID FUNDING FOR FY 1980. (MOTION FAILED) SEE NOTE(S) 5"
96,Senate,49,1979-04-25,,,30,61,0.125,0.016,-0.217,-0.428,-27.444,,,,,"TO AMEND S. CON. RES. 22 BY REDUCING BUDGET AUTHORITY AID OUTLAYS FOR THE FOOD STAMP PROGRAM BY $1 BILLION IN FISCAL 1980, TO THE AMOUNT AUTHORIZED BY LAW. (MOTION FAILED) SEE NOTE(S) 5"
96,Senate,50,1979-04-25,,,36,56,0.177,-0.547,-0.218,-0.29,-30.619,,,,,"TO AGREE TO A SUBSTITUTE FOR S. CON. RES. 22.  THE ROTH AMENDMENT PROVIDES A $10 BILLION RESTRAINT IN FEDERAL SPENDING, PHASED-IN TAX REDUCTIONS, AND A BALANCED BUDGET IN 1981.   (MOTION FAILED) SEE NOTE(S) 5"
96,Senate,51,1979-04-25,,,38,55,0.036,-0.025,-0.166,-0.226,-36.034,,,,,TO AMEND S. CON. RES. 22 BY CUTTING 11.6 BILLION IN BUDGET AUTHORITY AND $8.4 BILLION IN OUTLAYS FROM THE RECOMMENDATIONS OF THE SENATE BUDGET COMMITTEE FOR FY 1980. THE DOMENICI AMENDMENT ALSO CALLS FOR A TAX CUT IN 1980 AND A BALANCED BUDGET IN 1981.   (MOTION FAILED) SEE NOTE(S) 5
96,Senate,52,1979-04-25,,,40,52,0.24,-0.921,-0.193,-0.256,-38.103,,,,,"TO AMEND S. CON. RES. 22 BY ESTABLISHING A ""NO REAL GROWTH FEDERAL BUDGET"" THAT LIMITS THE GROWTH OF FEDERAL SPENDING TO THE INFLATION RATE FOR THE NEXT THREE YEARS, AND PROVIDING FOR A TAX CUT $12 BILLION MORE THAN THE BUDGET COMMITTEE RECOMMENDS DURING FISCAL 1981-82 WHILE STILL BALANCING THE FISCAL 1981 BUDGET.   (MOTION FAILED) SEE NOTE(S) 5"
96,Senate,53,1979-04-25,,,68,21,0.297,0.127,0.103,0.262,-40.486,,,,,TO AMEND S. CON. RES. 22 BY INCREASING FUNDS BY $100 MILLION FOR TITLE III OF THE OLDER AMERICANS ACT AND FOR THE MEALS ON WHEELS PROGRAM.    (MOTION PASSED) SEE NOTE(S) 5
96,Senate,54,1979-04-25,,,26,62,-0.421,0.232,0.119,0.221,-43.374,,,,,TO AMEND S. CON. RES. 22 BY CUTTING NATIONAL DEFENSE BUDGET AUTHORITY AND OUTLAYS FOR FISCAL 1979-1982 BY $1.3 BILLION IN ORDER TO ASSURE NO FUNDING FOR THE PURCHASE OF IRANIAN SHIPS.    (MOTION FAILED) SEE NOTE(S) 5
96,Senate,55,1979-04-25,,,15,69,0.24,0.893,-0.295,-0.181,-16.385,,,,,TO AMEND S. CON. RES. 22 BY PROVIDING A PROCEDURE BY WHICH NO NEW BILLS OR RESOLUTIONS GRANTING NEW BUDGET OR SPENDING AUTHORITY FOR FISCAL 1980 COULD BE INTRODUCED UNTIL THE SECOND CONCURRENT RESOLUTION HAS BEEN AGREED TO. (MOTION FAILED) SEE NOTE(S) 5
96,Senate,56,1979-04-25,,,41,44,-0.034,-0.143,-0.191,-0.21,-30.393,,,,,"TO AMEND S. CON. RES. 22 BY PROVIDING FOR A $1.1 BILLION REDUCTION IN THE ALLOWANCE FUNCTION OF THE BUDGET TO ACCOMMODATE FUNDING FOR FEDERAL OVERTIME PAY, FEDERAL FILMMAKING, FEDERAL TRAVEL, AND FOR A REDUCTION IN THE FEDERAL WORK FORCE.    (MOTION FAILED) SEE NOTE(S) 5"
96,Senate,57,1979-04-25,,,38,46,-0.023,-0.239,0.048,0.163,-53.372,,,,,TO AMEND S. CON. RES. 22 BY INCREASING FUNDING FOR THE LAW ENFORCEMENT ASSISTANCE ADMINISTRATION BY $100 MILLION. (MOTION FAILED) SEE NOTE(S) 5
96,Senate,58,1979-04-25,,,49,36,0.371,-0.865,0.177,0.355,-39.295,,,,,TO AMEND S. CON. RES. 22 BY INCREASING BUDGET AUTHORITY AND OUTLAYS BY $300 MILLION IN THE INCOME SECURITY FUNCTION FOR FISCAL 1980-1982. (MOTION PASSED) SEE NOTE(S) 5
96,Senate,59,1979-04-25,,,54,30,0.077,0.081,0.208,0.333,-26.384,,,,,TO AMEND S. CON. RES. 22 BY INCREASING BUDGET AUTHORITY BY $500 MILLION AND $600 MILLION IN OUTLAYS FOR THE FOOD STAMP PROGRAM IN FISCAL 1979.   (MOTION PASSED) SEE NOTE(S) 5
96,Senate,60,1979-04-25,,,83,0,0.0,0.0,0.0,0.0,0.0,,,,,"TO AMEND S. CON. RES. 22 BY REDUCING TRAVEL AND FILMMAKING BY $400 MILLION IN 1980, BY $500 MILLION IN 1981, AND BY $600 MILLION IN 1982.  (MOTION PASSED) SEE NOTE(S) 5"
96,Senate,61,1979-04-25,,,64,20,0.388,-0.486,0.146,0.103,-33.5,,,,,"TO AGREE TO S. CON. RES. 22, AN ALTERNATIVE CONGRESSIONAL BUDGET.    (MOTION PASSED) SEE NOTE(S) 5"
96,Senate,62,1979-04-26,,,48,40,0.065,-0.278,0.205,0.29,-31.1,S210,,,,"TO TABLE THE MODIFIED HATCH AMENDMENT TO S. 210, A BILL TO ESTABLISH A FEDERAL DEPARTMENT OF EDUCATION.  THE MODIFIED HATCH AMENDMENT CALLS ON THE SECRETARY OF EDUCATION TO INFORM AND ADVISE THE LOCAL UNITS ABOUT REGULATIONS AND PERMITS A MAJORITY OF LOCAL EDUCATION AUTHORITIES TO DISAPPROVE A DEPARTMENT OF EDUCATION REGULATION WITHIN 30 DAYS OF ITS PUBLICATION.   (MOTION PASSED)"
96,Senate,63,1979-04-26,,,28,58,0.145,-0.027,-0.166,-0.175,-31.758,S210,,,,TO AMEND S. 210 BY DELETING THE TRANSFER OF THE FUNCTION OF THE DEPARTMENT OF DEFENSE OVERSEAS SCHOOL SYSTEM TO THE PROPOSED DEPARTMENT OF EDUCATION.  (MOTION FAILED) SEE NOTE(S) 4
96,Senate,64,1979-04-26,,,38,45,0.291,-0.572,-0.138,-0.391,-40.769,S210,,,,"TO AMEND S. 210 BY PROHIBITING THE PRESIDENT FROM TRANSFERRING ANY ADDITIONAL FUNCTIONS NOT SPECIFICALLY PERMITTED BY THIS ACT, TO THE SECRETARY OF EDUCATION."
96,Senate,65,1979-04-30,,,26,58,0.179,0.086,-0.127,-0.121,-37.213,S210,,,,TO AGREE TO A SUBSTITUTE FOR S. 210.  THE SCHWEICKER AMENDMENT RESTRUCTURES THE EDUCATION DIVISION OF HEW AND PROVIDES FOR A NEW UNDERSECRETARY OF EDUCATION TO REPORT DIRECTLY TO THE SECRETARY OF HEW.   (MOTION FAILED) SEE NOTE(S) 4
96,Senate,66,1979-04-30,,,16,73,0.211,0.32,-0.174,-0.392,-23.597,S210,,,,TO AMEND S. 210 BY REQUIRING PARENTAL NOTIFICATION AND CONSENT BEFORE STUDENTS COULD PARTICIPATE IN SEX EDUCATION CLASSES IN PUBLIC ELEMENTARY AND SECONDARY SCHOOLS. SEE NOTE(S) 4
96,Senate,67,1979-04-30,,,68,24,0.284,-0.522,0.304,0.29,-19.833,S210,,,,"TO TABLE AN APPEAL ON THE RULING OF THE CHAIR CONCERNING THE JEPSON AMENDMENT TO S. 210.  THE JEPSON AMENDMENT, RULED NOT GERMANE, REQUIRED THE SECRETARY OF EDUCATION TO PROMULGATE CERTAIN RULES CONCERNING UNION AFFILIATION.  (MOTION PASSED) SEE NOTE(S) 4"
96,Senate,68,1979-04-30,,,46,48,-0.047,-0.246,-0.131,-0.04,-44.159,S210,,,,TO AMEND S. 210 BY TERMINATING THE DEPARTMENT OF EDUCATION SIX YEARS AFTER THE ELECTIVE DATE OF THIS ACT.  (MOTION FAIL SEE NOTE(S) 4
96,Senate,69,1979-04-30,,,59,32,0.097,-0.038,0.18,0.161,-31.007,S210,,,,TO TABLE AN APPEAL ON THE RULING OF THE CHAIR CONCERNING THE HAYAKAWA AMENDMENT TO S. 210 RELATIVE TO ENFORCEMENT OF AFFIRMATIVE ACTION PROGRAM GUIDELINES.  THE CHAIR RULED THE HAYAKAWA AMENDMENT OUT OF ORDER.  (MOTION PASSED) SEE NOTE(S) 4
96,Senate,70,1979-04-30,,,72,21,0.368,-0.69,0.145,0.024,-36.926,S210,,,,"TO PASS S. 210, ESTABLISHING A FEDERAL DEPARTMENT OF EDUCATION.  (MOTION PASSED)"
96,Senate,71,1979-05-01,,,33,57,-0.24,-0.01,0.148,0.441,-36.379,S413,,,,"TO AMEND S. 413, THE AVIATION SAFETY AND NOISE ABATEMENT ACT OF 1979, BY STRIKING THE ADDITIONAL AUTHORITY GIVEN TO THE SECRETARY OF TRANSPORTATION TO WAIVE COMPLIANCE WITH CERTAIN NOISE STANDARDS.  (MOTION FAILED)"
96,Senate,72,1979-05-01,,,51,38,0.064,-0.446,-0.079,-0.25,-49.918,S413,,,,"TO AMEND S. 413, THE AVIATION SAFETY AND NOISE ABATEMENT ACT OF 1979, BY REQUIRING THAT NOISE REGULATIONS PROVIDE AUDIBLE RELIEF TO HUMAN BEINGS.   (MOTION PASSED)"
96,Senate,73,1979-05-01,,,78,15,-0.418,-0.129,-0.211,-0.557,-24.791,S413,,,,"TO PASS S. 413, THE AVIATION SAFETY AND NOISE ABATEMENT ACT OF 1979.  (MOTION PASSED)"
96,Senate,74,1979-05-02,,,89,3,-0.998,-0.068,-0.239,-0.384,-9.869,SRES122,,,,"TO AGREE TO S. RES. 122, A RESOLUTION APPROVING THE DEPARTMENT OF ENERGY STANDBY CONSERVATION PLAN NO. 2, DEALING WITH STANDBY EMERGENCY BUILDING TEMPERATURE RESTRICTIONS.  (MOTION PASSED)"
96,Senate,75,1979-05-02,,,60,33,-0.119,0.443,-0.001,0.292,-50.416,,,,,"TO ADVISE AND CONSENT TO THE NOMINATION OF ROBERT J. KUTAK, OF NEBRASKA, TO BE A MEMBER OF THE BOARD OF DIRECTORS OF THE LEGAL SERVICES CORPORATION.   (MOTION PASSED)"
96,Senate,76,1979-05-02,,,24,70,-0.666,0.714,0.214,0.48,-39.038,SRES123,,,,"TO AGREE TO S. RES. 123, A RESOLUTION APPROVING THE DEPARTMENT OF ENERGY STANDBY CONSERVATION PLAN NO. 3, DEALING WITH EMERGENCY ADVERTISING LIGHTING RESTRICTIONS. (MOTION FAILED)"
96,Senate,77,1979-05-03,,,33,59,-0.204,0.904,-0.12,-0.241,-46.03,S429,,,,"TO TABLE THE HEINZ AMENDMENT TO S. 429, A BILL AUTHORIZING FUNDS FOR MILITARY PROCUREMENT, RESEARCH AND DEVELOPMENT, AND CONSTRUCTION PROGRAMS FOR FISCAL 1979.  THE HEINZ (CONTINUED) AMENDMENT PROHIBITS FUNDS FROM BEING USED FOR CARRYING OUT THE SERVICE LIFE EXTENSION PROGRAM FOR THE AIRCRAFT CARRIER SARATOGA, WITH CERTAIN EXCEPTIONS.  (MOTION FAILED)"
96,Senate,78,1979-05-03,,,52,39,-0.229,0.96,0.149,0.206,-44.521,S429,,,,TO TABLE THE MOTION TO RECONSIDER THE VOTE BY WHICH THE BIDEN AMENDMENT TO THE HEINZ AMENDMENT TO S. 429 WAS AGREED TO (SEE RC 77).  THE BIDEN AMENDMENT (ADOPTED BY VOICE VOTE) REQUIRES THAT THE SERVICE LIFE EXTENSION PROGRAM FOR THE AIRCRAFT CARRIER SARATOGA BE CONDUCTED AT THE LOCATION DETERMINED LEAST EXPENSIVE TO THE GOVERNMENT.  (MOTION PASSE
96,Senate,79,1979-05-03,,,41,50,-0.269,0.963,-0.15,-0.205,-45.647,S429,,,,TO AMEND THE HEINZ AMENDMENT TO S. 429 (SEE RC 77).  THE WARNER AMENDMENT PERMITS THE SLEP PROGRAM TO BE CONDUCTED NOT ON THE BASIS OF LEAST COST IF THE PRESIDENT DETERMINES THAT THE U.S. NATIONAL INTEREST REQUIRES OTHER CONSIDERATIONS.   (MOTION FAILED) SEE NOTE(S) 6
96,Senate,80,1979-05-03,,,32,56,-0.007,-0.65,0.167,0.303,-36.571,S429,,,,TO AMEND S. 429 BY REDUCING THE AUTHORIZATION OF FISCAL 1979 SUPPLEMENTAL APPROPRIATIONS FOR NAVY SHIP PROCUREMENT TO DELETE ADDITIONAL FUNDS FOR TWO OF THE FOUR IRANIAN (CONTINUED) DESTROYERS.  (MOTION FAILED) SEE NOTE(S) 6
96,Senate,81,1979-05-03,,,77,12,-0.42,-0.253,-0.188,-0.275,-24.494,S429,,,,TO PASS S. 429.  (MOTION PASSED)
96,Senate,82,1979-05-07,,,21,68,-0.484,-0.272,0.076,0.153,-46.662,S440,,,,"TO TABLE THE MODIFIED THURMOND AMENDMENT TO S. 440, A BILL AUTHORIZING FUNDS THROUGH FISCAL 1982 FOR A PROGRAM TO AID IN THE PREVENTION AND SPREAD OF ALCOHOLISM.  THE THURMOND AMENDMENT REQUIRES A HEALTH WARNING ON THE LABELS OF BOTTLES CONTAINING CERTAIN ALCOHOLIC BEVERAGES.  (MOTION FAILED)"
96,Senate,83,1979-05-08,,,16,81,0.095,-0.939,0.081,0.452,-35.122,SRES121,,,,"TO DISCHARGE THE COMMITTEE ON ENERGY AND NATURAL RESOURCES FROM FURTHER CONSIDERATION OF S. RES. 121, A RESOLUTION APPROVING STANDBY EMERGENCY WEEKEND SALES RESTRICTIONS ON GASOLINE.   (MOTION FAILED)"
96,Senate,84,1979-05-08,,,66,30,-0.951,-0.308,-0.036,-0.164,-58.893,SRES153,,,,"TO AGREE TO S. RES. 153, APPROVING A CARTER ADMINISTRATION AMENDMENT TO THE DEPARTMENT OF ENERGY STANDBY GASOLINE RATIONING PLAN NO. 1, (CONTINGENCY PLAN NO.6).  THE AMENDMENT BASES INDIVIDUAL GAS COUPON DISTRIBUTION ON EACH STATE'S PAST RATE OF CONSUMPTION PER VEHICLE, RATHER THAN DISTRIBUTING THE COUPONS EQUALLY AMONG VEHICLE OWNERS WITHOUT REGARD TO THE STATE'S PAST RATE OF GAS USAGE. (MOTION PASSED)"
96,Senate,85,1979-05-08,,,58,39,0.207,-0.978,0.083,0.04,-58.532,SRES120,,,,"TO AGREE TO S. RES. 120, APPROVING THE DEPARTMENT OF ENERGY STANDBY GASOLINE RATIONING PLAN NO.1.   (MOTION PASSED)"
96,Senate,86,1979-05-10,,,87,2,0.0,0.0,0.0,0.0,0.0,S586,,,,"TO AMEND THE BAKER AMENDMENT TO S. 586, A BILL AUTHORIZING FUNDS FOR FISCAL 1980-1981 FOR THE DEPARTMENT OF STATE. THE BAKER AMENDMENT REPEALS SECTION 21 OF THE STATE DEPARTMENT AUTHORIZATION ACT OF 1977 THAT REMOVED THE DISCRETION OF THE SECRETARY OF STATE TO RECOMMEND THE GRANTING OF TEMPORARY NON-IMMIGRANT VISAS FOR MEMBERS OF COMMUNIST ORGANIZATIONS. THE JAVITS AMENDMENT CLARIFIES THE AUTHORITY OF THE SECRETARY OF STATE BY RESTRICTING THE ISSUANCE OF TEMPORARY VISAS FOR MEMBERS OF LABOR ORGANIZATIONS RUN BY TOTALITARIAN GOVERNMENTS AND MEMBERS OF THE PALESTINE LIBERATION ORGANIZATION.   (MOTION PASSED)"
96,Senate,87,1979-05-10,,,70,19,-0.34,-0.233,-0.183,-0.231,-32.568,S586,,,,"TO AMEND S. 586, A BILL AUTHORIZING FUNDS FOR THE DEPARTMENT OF STATE, BY MAKING AUTHORIZATION FOR ONE YEAR ONLY. (MOTION PASSED)"
96,Senate,88,1979-05-10,,,56,32,0.148,-0.066,0.172,0.575,-33.241,S586,,,,"TO TABLE THE THURMOND AMENDMENT TO S. 586, A BILL AUTHORIZING FUNDS FOR THE DEPARTMENT OF STATE.  THE THURMOND AMENDMENT REDUCES AUTHORIZATION LEVEL FOR FUNDING OF IMMIGRATION AND REFUGEE PROGRAMS BY $71.5 MILLION. (MOTION PASSED)"
96,Senate,89,1979-05-14,,,7,76,-0.825,0.458,0.129,-0.353,-20.027,S1007,,,,"TO TABLE THE CHURCH SUBSTITUTE AMENDMENT TO THE HELMS AMENDMENT TO S. 1007, A BILL FOR EGYPTIAN-ISRAELI SECURITY ASSISTANCE.  THE HELMS AMENDMENT PROHIBITS FUNDS FROM BEING MADE AVAILABLE TO ANY COUNTRY WHICH IS NOT A PARTY TO THE TREATY ON THE NON-PROLIFERATION OF NUCLEAR WEAPONS.  THE CHURCH AMENDMENT URGES ALL NATIONS, INCLUDING ISRAEL AND EGYPT, WHO ARE NOT A PARTY TO THE TREATY TO BECOME SO. (MOTION FAILED)"
96,Senate,90,1979-05-14,,,73,11,0.563,0.326,0.102,0.265,-28.667,S1007,,,,"TO PASS S. 1007, AUTHORIZING $4.8 BILLION FOR MILITARY AND ECONOMIC ASSISTANCE TO ISRAEL AND EGYPT.   (MOTION PASSED)"
96,Senate,91,1979-05-15,,,54,35,0.142,-0.448,0.281,0.37,-24.108,HR3363,,,,"TO TABLE THE HELMS AMENDMENT TO H.R. 3363, A BILL AUTHORIZING FUNDS FOR FISCAL 1980 FOR THE DEPARTMENT OF STATE.  THE HELMS AMENDMENT DECLARED THAT EFFECTIVE JANUARY 1, 1980, THE FURNISHING OF TECHNICAL ASSISTANCE BY THE UNITED NATIONS AND ITS SPECIALIZED AGENCIES SHALL NOT BE CONSIDERED AN OBLIGATION OF THE UNITED STATES.  (MOTION PASS"
96,Senate,92,1979-05-15,,,75,19,-0.465,0.24,-0.375,-0.718,-21.803,HR3363,,,,TO AMEND H.R. 3363 BY EXPRESSING THE SENSE OF CONGRESS THAT ZIMBABWE RHODESIA HAS COMPLIED WITH THE PROVISIONS OF INTERNATIONAL SECURITY ASSISTANCE ACT OF 1978 AND THAT SANCTIONS SHOULD BE LIFTED WITHIN 10 DAYS AFTER THE INSTALLATION OF A BLACK MAJORITY GOVERNMENT.   (MOTION PASSE SEE NOTE(S) 7
96,Senate,93,1979-05-15,,,83,11,-0.478,-0.078,-0.219,-0.374,-24.396,HR3363,,,,"TO AGREE TO A SUBSTITUTE FOR A HELMS AMENDMENT TO H.R. 3363 (SEE RC 94). THE BYRD AMENDMENT PROVIDES THAT 14 DAYS AFTER THE INSTALLATION OF A NEW GOVERNMENT OR BY JUNE 30, 1979, THE PRESIDENT SHALL SUBMIT TO CONGRESS A REPORT CONCERNING SANCTIONS AGAINST RHODESIA.  (MOTION PASSED) SEE NOTE(S) 7"
96,Senate,94,1979-05-15,,,74,21,-0.354,-0.048,-0.229,-0.282,-27.748,HR3363,,,,TO AMEND H.R. 3363 BY EXPRESSING THE SENSE OF CONGRESS THAT SANCTIONS AGAINST RHODESIA SHOULD BE LIFTED AND REQUIRING THE PRESIDENT TO REPORT TO CONGRESS ON THE SANCTIONS. (MOTION PASSED) SEE NOTE(S) 7
